name,description,website,cause_area,address,country,contact_number,email,contact_person
AUSTRALIAN CATHOLIC RELIEF/CARITAS AUSTRALIA (ACR/CA) (ACR/CA),"1. Provide funding support to CNGOs working in the field of health, HIV/AIDS and OVC (prevention, care, treatment and support, impact mitigation), livelihood and infrastructure2. Capacity building to CNGO partners3. Technical support to CNGO partners4. Monitoring and evaluation",http://www.caritas.org.au,Sustainable Changes with Dignity Program,"# 53, Street 350, Sangkat Boueng Keng Kong III, Khan Chamkarmorn, Phnom Penh",Cambodia,(855-23) 220 200,acrcaritas@acr-caritas.org,"Mr. Lay Sothy, Partnership Program Coordinator, Tel: 012 890 609, E-mail: sothy@acr-caritas.org"
ACTION FOR HEALTH (AFH),"1. Family Planning2. Safe Motherhood3. Safe Abortion4. Health Equity Fund5. HIV/AIDS, TB, and Malaria6. Community Based Health 7. Insurance (CBHI)8. Reproductive Health9. Voucher for pregnant women",,1. Health Equity Fund2. Reproductive Health3. Community Based Health 4. Insurance (CBHI),"#40F, Corner Stree 167 and 426, Sangkat Tuol Topong 2,Khan Chamkamon,Phnom Penh.",Cambodia,"(855-23) 223 859, (855-12) 279 926,(855-16) 888 170, (855-12) 960",AFH@ezecom.com.kh,"Dr. Long Leng, Executive Director, Tel: 016 888 170, E-mail: longlenghealthy@yahoo.com"
ACTION FOR HEALTH DEVELOPMENT  (AHEAD),"1. Group education on HIV/AIDS and TB key messages for prevention of the infections using the health staff and peer educators in prison.2. Counseling suspected TB and collects the sputum to lab for TB diagnosis.3. Counseling suspected HIV prisoners and draws blood and refers the blood samples to VCCT.4. Register for all PLHIV and TB clients in the prisons and develop and strengthen the follow up system for OI/ART and referral system when the PLHIV and TB prisoners release from the prison. 5. Health staff training on basic HIV/AIDS, TB clinical and management, option II and palliative care in Banteay Meanchey, Battambang, Pursat and CC4. 6. NGO and related sectorsâ quarterly meeting for problem solving that face during implementation the project.7. Peer educator training on HIV/AIDS basis course, Counseling and palliative care in Banteay Meanchey, Battambang, Pursat and CC4. 8. Provision of the needed supports of PLHIV and TB are staying in the hospital and at prison.9. Financial support for transportation fees for PLHIV and TB follow up at OI/ART and TB.10. IEC materials distributed to the prisoners with health education11. Provide monitoring and technical assistance to the health staff to improve the services.12. Support materials to improve prisonersâ hygiene and prison sanitation.13. Provide needed support to the health posts for providing health services to the inmates.14.", ,1. Continued Achievement of Universal Access of HIV/STI Prevention Treatment and Care Services in  Cambodia2. Better Health in Prison,"#451, Street 515,Wat Romdul  Village, Sangkat Chamkar Samrong, Battambang Town, Battambang Province",Cambodia,(855-53) 952 898,bunsieth@online.com.kh,Mr. Heng Bunsieth Executive Director Tel: 012 907 802 E-mail: bunsieth@ahead.org.kh
APHIVAT STREY ORGANIZATION (AS),.Education about nutrition    .Providing agricultural technical                            .Provide soft loans                   .Compile saving group  ,n/a,Community Development,"#518,Group 25,Wat Rumduol Village,Sangkat Chamkarsamrong ,Battambang Municipality,Battambang Province.",Cambodia,(855-53) 952 433/012 818 577,asbtb@camintel.com,"Ms. Thong Thavrin, Director, (855-12) 818 577, asbtb@comintel.com"
ARV USERS ASSOCIATION (AUA),"1. Prorovide therapeutic education, emotional and psycho-social support to PLHIV receiving treatment in the Khmer Soviet Friendship Hospital, Meanchey RH, Samdach Euv RH, Pochentong RH, Chamkar Doung- HC in Phnom Penh and the Kampong Cham RH, Chamkar Leu-RH, Srey Santhor-RH in Kg.Cham province and Kean Svay-RH â Kandal province in order to promote adherence and better quality of life; and to empower PLHIV to understand their rights to quality of care2. Facilitate the reception of patients and document management within the OI/ART consultation areas at  Khmer Soviet Friendship Hospital, Meanchey RH, Samdach Euv RH, Pochentong RH, Chamkar Doung- HC in Phnom Penh and the Kampong Cham RH, Chamkar Leu-RH, Srey Santhor-RH in Kg.Cham province and Kean Svay-RH Kandal province and also assist for patient file management in KSFH.3. Play a key role on Positive Prevention at the KC RH, CL, SS and KSFH RH OI/ART clinic4. To attend and distribute AUA Promotional and educational materials at Candlelight Day, Water Festival and World AIDS Day events5. Build the capacity of PLHIV volunteers and staff of the association to better manage programs that reflect the needs of the PLHIV receiving treatment at the hospital and organizational development including the obtaining of the Health equity Fund card.6. AUA coordinate and organize  Tow  meeting with PLHIV from different IO/ART facilities to in order to build their knowledge about HIV and ART, encourage them to provide feedback about the quality of treatment and care where they are receiving and to discuss common issues and enable patients to understand the purpose and activities of AUA, mutual sharing of information on health care and to stimulate their families to receive blood tests.Small group discussions regarding treatment and issues affecting patients, educational role plays, question and answer sessions, patient experiences/testimonies and discussed were lack of social support, barriers and challenges to access health services, the difficulty of finding a job, causes of discrimination.    âââââ                                                                   ",http://www.auacambodia.org,PLHIV Psychosocial support within OI/ARV structure,"Khmer-Soviet Frendship  Hospital, Street 271, Phnom penh.        ",Cambodia,"(855-23) 222 054, (855-17) 337 218","sienghorn@auacambodia.org, info@auacambodia.org, afo@auacambodia.org","Mrs. Han Sieng Horn, Executive Director, (855) 17 847 356, Sienghorn@auacambodia.org "
BUDDHISM FOR DEVELOPMENT (BFD),"1.Taking Care home by home for PLHIV/OVC2. Provide health care, social, and emotional support to PLHIV/OVC and family3. Provide education for PLHIV/OVC and general population on HIV/AIDS and health care.",http://www.bfdkhmer.com,1. Home Based Care(ICP)2. SAHACOM,"Wat Anlongvil, Anlongvil commune, Sangker district, Battambang province",Cambodia,(855-12) 817 915,bfdkhmer@bfdkhmer.org,"Mr. Prak chear, Health Program Officer, (855-12) 736 042, p-chear@bfdkhmer.org "
BATTAMBANG WOMENÃâ¬S AIDS PROJECT (BWAP),1. Home Based Care2. Prevention,n/a,1. ICP (Integrated Care and Prevention)2. SAHACOM ( Sustainable Action against HIV and AIDS in Communities ),"#109, Group 5, Wat romdoual Village, chamka samroung Commune, BTB Town &Province.; ",Cambodia,(855-53) 952 150/ (855-17) 98 98 11 ,ingsivheng@yahoo.com,"Ms. Sen Sopheap, Program Coordinator, (855-16) 954 552 / 077 95 22 75, sopheap_sen07@yahoo.com"
COORDINATION OF ACTION RESEARCH ON AIDS AND MOBILITY (CARAM CAMBODIA),"1. Participatory Action Research2. Regional Coordination3. Advocacy, Networking and Partnership4. Community Based Prevention, Care and Rights for Migrant Workers5. Repatriation Reintegration and Support Advocacy and Networking6. Outreach education7. Drop in centre8. Finger prick test for HIV and Syphillis9. Legal counselling and represent as court10. Provide training ",http://www.caramcambodia.org,1.Counter Human Traffickig in Labor Migration2. Sustainable Action Against HIV/AIDS Community (SAHACOM)3. Ending Voilence against Women Migrant Workers,"#193AE0, St. 63, Beoun Keng kang I, Phnom Penh",Cambodia,(855-23) 218 065,caram.cam@online.com.kh,"Mr. Ya Navuth, Executive Director, (855-12) 961 427, ya_navuth@yahoo.com"
CARE INTERNATIONAL IN CAMBODIA (CARE),"1. Health referral2. Clients and Provider rights3. Community Score card4. HIV/AIDS education in workplace (garment factory), Workplace referral system, Creation of HIV/AIDS committees in workplace",http://care-cambodia.org,1. Socially Marginalised Women2. Ethnic Minority Women.                   3. Emergencies & Disasters,"P.O.Box 537, House 06, Street 446, Sangkat Tuol Tom PoungI, Phnom Penh",Cambodia,(855-23) 215 267 / 8 / 9,care.cam@care-cambodia.org,Ms. Stav Zotalis Country Director Email: stav.zotalis@careint.org
CARITAS CAMBODIA (CARITAS),"1.  Education/counseling/home visits/referral to VCCT,OI/ARV clinic, TB, PMTCT /Food support, welfare/ OVC support/ SHG support with microcredit and livelihood program2. Temporary shelter for PLHIV from far away areas and Waiting home for HIV+ Pregnant women /Education-counseling/Nutrition/Handicraft and sewing skills training3. Setting up health system at prison with H.post/referral system/coordination with PHD-OD-HC/ Active case finding for TB, counseling and testing for HIV/ NCD management/ socio-economic support with food support, vocational training/ education and drug users counseling",http://www.caritascambodia.org,1. Community Based Prevention Care and Support Program2. Prison Health Program for 7 prisons with HIV and TB focus,"St. Lauk Taneuy, Wat Bo Village, Salakamroeuk commune, SRP District, Siem Reap Province",Cambodia,(855-63) 963 279 / 012 735 477,glisse.bernadette@caritascambodia.org ,"Ms. Bernadette Glisse, Health &HIV;/AIDS program Coordinator, (855-12) 735 477, glisse.bernadette@caritascambodia.org"
CAMBODIAN CHILDREN AGAINST STARVATION AND VIOLENCE ASSOCIATION (CCASVA),1. Improved Reproductive Health through HIV/AIDs Prevention and care2. Intergrade Care Prevention,http://www.ccasva.org,1.Integrated Care and Prevention- ICP,"#32 c, Street 374, Sangkat Toul Svay Prey I, Khan Chamcar Morn,  Phnom Penh, Cambodia, P.O. Box 2203,",Cambodia,(855-23) 6414443,ccasva@ccasva.org,"Phok Bunroeun, Executive Director, (855-12) 888 613, bunroeun@ccasva.org"
CAMBODIAN DEVELOPMENT AND RELIEF CENTER FOR THE POOR (CDRCP),"1. Conducting HIV/AIDS prevention, Reproductive Health with Gender mainstreaming thru group discussion with general population, particularly youth and married men and women.2. Providing social support for PLHAs and Orphans and Vulnerable children (OVC), and support for their schooling.3. Providing counseling and referrals to health facilities at Referral Hospital in Kompong Trach District, Kampot Province for blood testing, care and ARV treatment for  PLHA and OVC in Kompong Trach, and Banteay Meast and in Dang Tung District, 4. Capacity Building to Community Assistants for Project Sustainability to continue facilitation to group discussion, communication and advocacy.5. Supporting 2 Care givers for providing care to PLHA with no family and relative in Kompong Trach Referral Hospital.6. Writing poems and songs about Human Rights, Peace, Banding Landmines, Domestic Violence and HIV/ AIDS related to girl prostitution, lives of OVC and PLHAs, the compulsion to suicide, the denial of midwives in helping infected woman in delivery baby, ways of prevention of HIV transmission etc. in Khmer with English translation on the screen for education and advocacy for discrimination reduction. 7. Producing KARAOKE songs about HIV/AIDS. Some AIDS karaoke songs were showed in XV International HIV/AIDS Conference in Bangkok, Thailand in 2004.8. Raising Advocacy through song presentation and song competition, short stories concerning to Women Rights and Health, Domestic Violence, Prostitution, HIV/AIDS, Morality and reduction of stigma and discrimination to promote the rights of PLHA, OVC and their families with quizzes and answers to large congregation of people in target villages, districts, in Kampot town and in Phnom Penh during HACC HIV/AIDS Campaign during Water Festival .9. Distribution some AIDS Karaoke songs to some NGOs, Commune Councils and pagodas for education in their community.  10. Providing Charity Boxes to pagodas and organizing management committees for supporting PLHA, OVC, poor and serious ill people.11. Conducting education on  Reduction in Maternal Mortality, Safe Abortion through group discussion in 120 villages and organizing awareness events through songs and comedy, short stories about Safe Abortion with question and answers to large congregation of people in 4 districts of Kampot Province12. Partnership with CIH (Center for International Health), University of Toronto, Canada, Cambodia brand office in Kep City for providing field study and visit for students from University of Tor",n/a,HIV/AIDS Prevention,"Kompong Trach District, Kampot Province",Cambodia,(855-12) 651 123, cdrcp.cambodia@yahoo.com,"Ms. Leng Sothea, Executive Director, (855-12) 651 123, cdrcp.cambodia29@yahoo.com"
CAMBODIAN HIV/AIDS EDUCATION AND CARE (CHEC),"1. Provide training workshops on HIV/AIDS and Reproductive Health and Life Skills to Adult Orphaned Vulnerable Children.2. Provide technical support to the HBC and SHG team leaders.3. Provide monthly referral support to PLHIV/CIA to get ARV/OI at referral hospital through HBC Teams and Identify new suspected cases refer to the VCCT service, monthly meeting MMM will be attended by PLHIV representatives at Provincial level and attend HIV/AIDS events at provincial level.4. Provide monthly home visits to provide support and counseling to PLHIVs.5. Provide school uniforms to OVC.6. Provide refresher training workshops on Linked Response to HBC Teams.7. Provide technical support to the HBC and SHG team leaders.8. Provide monthly referral support to PLHIV/CIA to get ARV/OI at referral hospital through HBC Teams and Identify new suspected cases refer to the VCCT service, monthly meeting MMM will be attended by PLHIV representatives at Provincial level and attend HIV/AIDS events at provincial level.9. Provide monthly home visits to provide support and counseling to PLHIVs.10. Provide training courses on HIV/AIDS, STI, reproductive health, life skills for youth peers, women peers and men peers in target ODs.11. Provide technical support to Peers Groups12. Provide training to other NGOs and institutions13. Advocacy for reducing the spread of HIV/AIDS through media and IEC materials.14. Conduct community forums in 7 ODs.15. Provide small business grant to 1,300 HIV positive women after livelihood training.16. Provide refresher livelihood training skills to HIV positive women.17. Provide referral support to HIV positive women to access OI/ARV and PMTCT services.",http://www.checcambodia.org,a. Prevention HIV/AIDS Projectb. HBC/OVC Project (Care and Support)c. HBCd. Livelihood Project (Impact Mitigation),"#86, St. 608, Sangkat Beoung kak2,Khan Toul Kork, Phnom Penh.",Cambodia,(855-23) 884 473,chec@online.com.kh,"Dr. KasemKolnary, Director, (855-12) 945 077, chec@online.com.kh"
CAMBODIA HEALTH EDUCATION MEDIA SERVICE (CHEMS),1.Produce TV shows2.Produce Newsletter3.Produce TV Learning Note4.Produce  Video Training 5.Produce Video Case study6. Radio Show Program7. Run listener club8. Organize Annual Awards for journalists,http://www.chems.org.kh,"1. Learning Program, The Demand for Good Governance Project2. Improving Journalism Code Ethict in Cambodia","No 26, Street 3 (Borei Peng Hout near Vimean Sopheak Monkol) Sangkat Steoun Mean Chey, Khan Mean Chey, Phnom Penh",Cambodia,(855-23) 218 410,Ms. Kim Sokuntheary Executive Director Tel: 012 285 678 E-mail: kimsokuntheary@gmail.com ed-chems@online.com.kh,"Mrs. Kim Sokuntheary, Executive Director , (855-12) 28 5678, ed-chems@online.com.kh"
CAMBODIAN ISLAMIC YOUTH ASSOCIATION (CIYA),,n/a,,"# 16, Strret 63, Sangkat Tonle Basac, Khan Chamcarmorn, Phnom Penh.",Cambodia,(855-16) 860 694,ciyainfor@yahoo.com/omalyciya@yahoo.com,Mr. Abupakar Sales President Tel: 016 860 694 Emial: ciyainfor@yahoo.com
COMMUNITY POVERTY REDUCTION  (CPR),"(SAHACOM) I- Program Component (Expected Result) 1: Improved coverage, quality and sustainability of comprehensive and integrated services for PLHIV (including MARPs) and OVC, which have successfully linked communities with public health and non-health services-Intermediate Result 1.1: Full coverage achieved and maintained in project sites of high quality comprehensive care, treatment and support services for PLHIV (including MARPs who are HIV positive) and OVC-Intermediate Result 1.2: Improved integration of HIV-related services for health, social welfare and impact mitigation with existing home and community-based care services-Intermediate Result 1.3.1: Increased capacity and sustainability of self help groupsII- Program Component (Expected Result) 3: Strengthened capacity and leadership of NGOs/CBOs and communities (especially those representing MARPs and PLHIV) leads to their meaningful participation in delivering quality and sustainable capacity of community based HIV prevention and care service-Intermediate Result 3.1: Increase technical and organization capacity of community based service and NGOs, incorporating best practice approaches(ICP) 1. To provide comprehensive care and support for people living with HIV/AIDS and OVC in the community with totally of 263 PLHIVs and 525 OVCs. 2. To promote community sensitization and reduce stigma and discrimination for people living with HIV/AIDS in community through HIV/AIDS education, events, and positive prevention.(ENRICH) -To reduce infant, child and maternal mortality through evidence based intervention(HSS) Objective 1: Strengthen Community Level MechanismsObjective 2: Improve Responsiveness of Primary Health Care FacilitiesObjective 3: Increase Knowledge of Community Members Regarding the 3 Dieses and Client rightsObjective 4: Lower access and utilization barriersObjective 5: Improve the Quality Climate for Community Level Primary Care",n/a,"1. Integrated Care and Prevention (ICP)2. Sustainable Action Against HIV and AIDS in Community (SAHACOM) 3. Evidence-based International for Improve Nutrition to Reinforce Infant, Child and Maternal Health in Cambodia (ENRICH)4. Health Strengthening System (HSS)","Thum Moyut Village, Pher commune,Khanpong Chhnang District,Kampong Chhnang Province",Cambodia,(855-92) 290 092,sengtack777@gmail.com,"Mr. Eung Sengkim, Executive Director, (855-12) 833 584, sengkim_cpr@yahoo.com "
CAMBODIAN RED CROSS (CRC),"1.Training of Outreach Workers and Peer-Outreach activities2. Referral for VCT, TB treatment3. Peer Educators and outreach workers meeting4. Vocational training for ex-L2drug users5. Sensitization workshops for local authority and leaders6. days training on agriculture for Ex-drug users7. Regular health check up for ex-drug users in rehabilitation center8. Drug outreach activities by peer educators 9. Referral ex-drug users in the rehabilitation center for VCCT10. Education reproductive women on nutrition and ANC11. General basic health education for Community population12. Referral services support for pregnant women13. Coordination monthly meeting for Outreach workers and Peer Educators14. Community education15. Provide referral services16. Home visit for PWD /PLHIV/OVC17. Home gardening 18. Provide vocational training19. Construction of hand dug (pump) wells20. Construction of household latrines21. Regular health check up for ex-drug users22. Conduct outreach activities23. Educate reproductive woman on nutrition and ANC",http://www.redcross.org.kh,1. Community Based Health Development (Funded by Australian Red Cross)2. Community Based Health Development (Funded by Italian Red Cross)3. Harm Reduction (Funded by Italian Red Cross)4. Malaria Prevention                                     5. WASH (Water Sanitation and Hygiene),"Lot 16A, Street 652@271, O Bek Kaam, Sangkat Toek Laak 3, Khan Tuol Kork, P.Penh",Cambodia,(+855-23) 881-511 / 881 153,crc_adm@online.com.kh,Lok Chum Tiev. Pum Chanthini Secretary General Tel : 012 921 105 E-mail :crc_adm@online.com.kh
CAMBODIAN WOMEN'S DEVELOPMENT AGENCY (CWDA),1.Training and Education2.Documentation3.Advocacy4. Meeting                             5.counseling6.Referral to assess health service,http://www.pub22.net/cwda/,1. Womenâs Health and HIV/AIDS Program,"#19, Street 242, Sangkat Boeung Prolit, Khan 7 Makara, Phnom Penh-Cambodia",Cambodia,(+855) 023 210 449 ,cwda@online.com.kh,Mrs. Hun Phanna Acting Executive Director Tel: 012 995 199  phannahun@gmail.com
CAMBODIAN WOMEN FOR PEACE AND DEVELOPMENT (CWPD),"Outreach education session to increase awareness on:- HIV/AID prevention- HARM reduction- Nutrition- Safe Saving and remittent- Reproductive and Birth spacing- Codom usedIEC material with key prevention message development and dissemination together with condomReferral EW to access heath and social services: HIV testing, STI screening and birth spacing, phsycology service,Pre ART/ART, vocational triningProvided finger prick to EWs by lay counselor Provide life skill training to target population on particular financial management (saving for future life)                                                                                                                           Support garment factory worker to work together in mutual support groups to identify and respond to social, economic and health concerns  Sensitization and awareness training for line supervisors, middle and senior managers on worker rights, and developing the capacity of MSG members to roll out the training to their peers.",http://www.cwpd.net,1. HIV Prevention Care and Support Program for entertainment Workers :SMARTGirl program2.  Reproductive project3. Better work project4. Sewing for a Brighter Future5.Community based Treatment 6.SMARTGirl plus project ,"No 128D9-D10, St. Sothearos, Sangkat Tonle Bassac, Khan Chamkamorn, Phnom Penh",Cambodia,"(855-23) 222 453, (855-12) 739 851",info@cwpd.net;  cwpd@online.com.kh; Sotheary@cwpd.net,"Mr.Chhorn Ann, Project Manager, (855) 12 95 94 47, ann.chhorn@cwpd.net"
DAN CHURCH AID/CHRISTIAN AID (DCA/CA),"working through partners on protection, prevention, awareness, accountability, advocacy, networking by provide funding supported to local and international NGOs in Cambodia.","http://www.danchurchaid.org, www.christianaid.org.uk ","Active Citizenship Program, Food Security Program; and Regional Safe migration program  ","#48, Street 242, Sangkat Chaktomouk, Khan Daupenh, Phnom Penh, Cambodia",Cambodia,(855-23)  21 62 61, ,Mr. Betty ThÃ¸gersen Country Representative 092 66 57 06 Email: beth@dca.dk
FRIENDSâ ASSOCIATION PIONEER  (FAP),1. Sellecting the poorest2. Providing training about small bussiness and  technical agriculture3. Social support-Loan4. Public Education about Hygine and sanitation,n/a,Support the poorest of the poor family,", Group 01, Kompong kdei 01 Village, Kompong kdei Commcene, Chikreng District, Siem Reap Province",Cambodia,(855-12) 943 155,sakun_peng@yahoo.com,"Mr. PengSakun, Executive Director, (855-10) 943 155/010 943 155, sakun_peng@yahoo.com"
FHI360Âº (FHI360Âº),"1. Targeted prevention and treatment for Most At Risk Population2. Strengthened quality and integration of selected CoC networks3. Strengthened surveillance, M&E and data utilization4. Strengthened systems, human and institutional capacity5. Cross cutting themes: strategic behavior communication, monitoring and quality assurance, gender equity and partnerships6. Targeting HIV/AIDS Prevention among MSM7. Increase access to needle and syringes and methadone treatment among drug users8. Improve the capacity building of health care providers to provide better  TB diagnosis and treatment 9. Increase access to TB-HIV diagnosis and treatment for marginalize groups and inmates10. Increase access to TB diagnosis and treatment through Public Private Partnership11. HIV/AIDS intervention among drug users using harm reduction approach", ,1. HIV Flagship2. Prayat Mosque3. Saksith4.  Cambodia Integrated HIV and Drug Prevention Implementation5.  EndAsia-Smartkids,"#03, St. 303,Sangkat Beoung Keng Kang III, Phnom Penh",Cambodia,(855-23) 211 914, ,Dr. Dr. Jamhoih Tonsing Country Director Tel: 092 202 494 E-mail: Jtonsing@fhi360.org
FRENCH RED CROSS/ CROIX-ROUGE FRANÃ§AISE  (FRC),"1. Watsan: Construction: Borehole, Ponds, DAMs2. Hydrogeologue: Weater station3. Agronimist: Distribution: Vegetable seeds, Tools Agriculture, Piglets, Hens, Rooster.4. Capacity building",http://www.croix-rouge.fr,Secure Water to Secure Food and Nutrition Project,"#16A, Street 271 off 652, O B'ek Kaam, Sangkat Toeuk Laak III, Khan Toul Kor, Phnom Penh, Cambodia",Cambodia,(+855) 023 883 670,hod-camb.frc@croix-rouge.fr,'Mr. David BOISSON Head of Delegation Tel: 023 883 670 E-mail: hod-camb.frc@croix-rouge.fr
MISSION OF GENEROUS CAMBODIAN ALLIANCE  (GENEROUS),"1. Home visit, referral to OI/ARV, PMTCT, link response including community outreach2. Awareness, education, outreach, training and, care & support including livelihood, networking among faith base group.",Wesite: www.generous-cambodia.org,"1.  To uptak universal access to HIV prevention, care and treatment.","# 9, Street 397, Phsardoum Thov, Khan Chamkarmorn, Phnom Penh",Cambodia,(855-12) 849 192,sokhoeun.generous@gmail.com ,"Mr. ChhonSokhoeun, Executive Director, (855-12) 849 192, sokhoeun_generous@yahoo.com"
HAGAR INTERNATIONAL  (HAGAR),"1. Research chiff NGO caring for PLWA2. Reviewed Hagar health standard to included HIV available 3. Provide the trainning to  staff and children on basic information of HIV/AIDS prevention5. Establish referral or partnership with other NGOs, government related to HIV/AIDS",http://www.hagarinternational.org,HAGAR health care project,"#19,St.57,  Boeung Keng Kang I, Khan Chamkarmon  PP.",Cambodia,(855-23)  211 961,Meng.sokchea@hagarinternational.org,"Dr. Meng Sokchea, Health Manager, (855-12) 612 912/(855-10) 612 912, meng.sokchea@hagarinternational.org"
